{
  "schema_version": "1.0.0",
  "rule_id": "far-rule-oci-components",
  "rule_version_id": "far-rule-oci-components.v001",
  "version_number": 1,
  "content_sha256": "2b6444175a6d0b170181be75d11e77cdebc080500c55a328603f326124e952c7",
  "content": {
    "title": "Pretax other comprehensive income components",
    "rule_statement": "Unrealized holding gains and losses on available-for-sale debt securities are excluded from earnings and reported in other comprehensive income, while trading-security changes, realized disposal results, and ordinary dividends are included in net income rather than OCI.",
    "applicability": "For-profit entities applying U.S. GAAP to the stated pretax security and income items.",
    "assertions": [
      {
        "assertion_id": "assertion-afs-debt-oci",
        "claim": "An unrealized holding gain on an available-for-sale debt security is reported in OCI before tax."
      },
      {
        "assertion_id": "assertion-earnings-items-excluded",
        "claim": "Trading-security gains, realized disposal losses, and dividend income are earnings items, not current-period OCI components."
      }
    ],
    "source_citations": [
      {
        "reference_version_id": "far-ref-fasb-codification-live.v001",
        "locator": "FASB ASC 320-10-35-1(b) and 220-10-45-10A (live official Codification)",
        "role": "controlling",
        "supports_assertion_ids": [
          "assertion-afs-debt-oci",
          "assertion-earnings-items-excluded"
        ]
      }
    ],
    "currency": {
      "assessed_at": "2026-08-13T20:00:00Z",
      "assessment": "current",
      "basis": "The live official Codification locators and FASB-hosted Update 2016-01 materials were cross-checked on 2026-08-13; no effective amendment affecting this treatment was identified."
    },
    "authorship_provenance": {
      "purpose": "admitted_evidence",
      "mechanism": "ai_assisted",
      "created_by": "Codex",
      "model_id": "openai-codex-gpt-5",
      "material_input_ids": [
        "far-ref-fasb-codification-live.v001",
        "FASB ASC 320-10-35-1(b) and 220-10-45-10A (live official Codification)"
      ]
    }
  }
}
