{
  "schema_version": "1.0.0",
  "rule_id": "far-rule-loss-contingency-range",
  "rule_version_id": "far-rule-loss-contingency-range.v001",
  "version_number": 1,
  "content_sha256": "77853e6376505c520b9fb60be9d3c764ce8a0c9c778afc91c85cc582741a09f1",
  "content": {
    "title": "Loss contingency range measurement",
    "rule_statement": "When a probable loss is reasonably estimable as a range and no amount within the range is a better estimate than another, the minimum amount in the range is accrued; a merely reasonably possible separate loss is not accrued.",
    "applicability": "For-profit entity loss contingencies under U.S. GAAP with the stated likelihood and estimability conclusions.",
    "assertions": [
      {
        "assertion_id": "assertion-range-minimum",
        "claim": "Accrue the minimum of a probable loss range when no point in the range is a better estimate."
      },
      {
        "assertion_id": "assertion-possible-not-accrued",
        "claim": "Do not accrue a separate loss assessed as reasonably possible rather than probable."
      }
    ],
    "source_citations": [
      {
        "reference_version_id": "far-ref-fasb-codification-live.v001",
        "locator": "FASB ASC 450-20-25-2 and 450-20-30-1 (live official Codification)",
        "role": "controlling",
        "supports_assertion_ids": [
          "assertion-range-minimum",
          "assertion-possible-not-accrued"
        ]
      }
    ],
    "currency": {
      "assessed_at": "2026-08-13T20:00:00Z",
      "assessment": "current",
      "basis": "The live official Codification locators and FASB-hosted 2023 Financial Reporting Issues Conference materials reproducing paragraph 450-20-30-1 were cross-checked on 2026-08-13; no effective amendment affecting this measurement rule was identified."
    },
    "authorship_provenance": {
      "purpose": "admitted_evidence",
      "mechanism": "ai_assisted",
      "created_by": "Codex",
      "model_id": "openai-codex-gpt-5",
      "material_input_ids": [
        "far-ref-fasb-codification-live.v001",
        "FASB ASC 450-20-25-2 and 450-20-30-1 (live official Codification)"
      ]
    }
  }
}
